"id_faq","question","answer","faq_type","created_date","modified_date","general_status_id","lang_code"
135,"For Van and Lorry Delivery, does the driver needs to help in loading/unloading of the goods?","Yes, the driver of the van or lorry will need to assist in loading and unloading of the goods.","agent","2019-07-25 18:56:13+08","2019-07-25 19:00:00+08",1,"en-us"
136,"What does it mean if there are Manpower Required under the Additional Services?","Manpower required means the Van/Lorry driver needs to bring an extra helper to assist in the loading and unloading. The number of manpower required would mean the number of helpers requires, not including the driver.","agent","2019-07-25 18:57:40+08","2022-11-24 09:33:19.294574+08",1,"en-us"
137,"What does it mean if there is Manpower Required under the Additional Services?","Manpower required means the Van/Lorry driver needs to bring extra helper to assist in the loading and unloading. The number of manpower required would means the number of helpers requires, not including the driver.","agent","2020-01-22 11:08:05.281788+08","2020-01-22 11:08:17.786646+08",15,"en-us"
138,"What happens if I provided the wrong pickup or delivery address?","If the driver arrives at the incorrect pickup address provided by the customer, a 50% cancellation fee is imposed.

If the driver has arrived at the wrong delivery address provided by the customer and needs to deliver to a new delivery address, there is a new delivery charge. ","customer","2020-06-26 10:14:56.259594+08","2022-11-24 14:38:02.449058+08",1,"en-us"
139,"What happens if there is a wrong address provided?","If you have arrived at the wrong Pickup address provided by the customer, there is a 50% cancellation fee, capped at a maximum of $10. 

If you have arrived or en-route to a wrong Delivery address provided by the customer and need to deliver to a new delivery address, there will be a new delivery charge of up to 100% of the original price.","agent","2020-07-24 11:42:15.934939+08","2023-06-01 11:54:11.529492+08",1,"en-us"
140,"What should I do for Parcels that need to be returned to the sender?","Please update the status to &#x27;Undelivered&#x27; and state the reason. After you have returned back to the sender, please update the status to &#x27;Returned&#x27;.","agent","2020-08-24 11:02:05.636878+08","2022-11-24 10:22:37.154818+08",1,"en-us"
141,"Can I block a delivery agent from accepting and delivering my Jobs?","Yes, you can now block the delivery agent from accepting your jobs. After you have logged into your web, go under Favourite -  tap &#x27;Block Agent&#x27;. ","customer","2020-08-24 11:09:06.444399+08","2022-11-24 11:12:05.226589+08",1,"en-us"
142,"What happens if I deliver a parcel late? Is there any penalty fee?","If you deliver a package late, uParcel may deduct your delivery fees up to 50% and if the item (if it&#x27;s food), is spoilt due to the late delivery, you will need to compensate for the item. Your account will also be suspended permanently if you have too many late deliveries.","agent","2020-09-05 09:10:46.749635+08","2022-11-24 09:38:18.203133+08",1,"en-us"
143,"What to do if the app prompts me to enter Pincode during delivery?","Please obtain the Pincode from the receiver and enter it into the app when updating to delivered. 

If the receiver is unsure, please contact the sender for Pincode or contact us. ","agent","2020-12-01 17:24:40.904509+08","2022-11-24 10:25:01.727945+08",1,"en-us"
144,"How to add a credit card for payment?","To save your credit card, you can do so when making payment for the delivery request or when topping up your E-wallet via credit card. 

You will be asked to save your credit card information for the payment. ","customer","2020-12-01 17:30:32.180474+08","2022-11-24 13:51:25.407878+08",1,"en-us"
145,"How to install Shopify API?","Please perform the following steps: 
1. Sign up for an account on the uParcel website
2. On your signed-in portal, Request a corporate account
3. Once we have approved your corporate account, you can then request API integration on your signed-in portal
4. Once we have approved your API request, you will be provided with a set of secret keys
5. Proceed to install the uParcel app on Shopify and then enter the secret keys to connect.

For any problems, please email express@uparcel.sg ","customer","2020-12-08 16:52:53.363454+08","2022-11-24 13:54:43.591211+08",1,"en-us"
146,"What are the packing requirements?","Your packing would need to meet the guidelines depending on your product, whether it is perishable or food. 

Please download the packing guide&lt;a href=&quot;https://uparcel.s3-us-west-2.amazonaws.com/uparceldelivery/user_guide/Your_Packing_Guide_UParcel_vJan2021_final.pdf&quot;&gt; here/a&gt;
","customer","2021-01-13 12:00:52.247402+08","2022-11-24 14:29:50.114663+08",1,"en-us"
147,"Is there a packing guide?","Please see packing guide on https://uparcel.s3-us-west-2.amazonaws.com/uparceldelivery/user_guide/Your_Packing_Guide_UParcel_vJan2021_final.pdf","customer","2021-01-13 12:01:15.750423+08","2021-01-13 12:01:15.750431+08",15,"en-us"
148,"How long does it takes for my E-wallet top up to be verified?","For E-wallet top-ups done by bank transfer or SGQR, it takes at least 1 working day for our Finance team to verify the payment from our bank. 

If you have used Giro Transfer, it may take up to 3 working days for the funds to be reflected in our bank account. 

You can use a credit card to make an immediate top-up; however, there are fees associated with this method.","customer","2021-07-14 15:09:02.607107+08","2022-11-24 13:37:23.647651+08",1,"en-us"
149,"How do I bulk upload orders or use excel file to upload my deliveries?","First, log-into your account and click on Bulk Upload and then download the sample excel file. For a detailed tutorial, you can click on the link below:

&lt;a href=&quot;https://www.youtube.com/watch?v=4bDYu6waMLU&quot;&gt;Bulk Upload Video Guide&lt;/a&gt;","customer","2021-08-04 11:52:03.071905+08","2022-11-16 11:08:47.804833+08",15,"en-us"
150,"How to use uParcel bulk upload function?","Refer to the video for a quick and step-by-step guide on our excel bulk upload feature:

&lt;a href=&quot;https://uparcel.s3.us-west-2.amazonaws.com/uparceldelivery/user_guide/bulk+upload+ver.3.mp4&quot;&gt;Bulk Upload Video Guide&lt;/a&gt;","customer","2021-08-11 10:58:47.695417+08","2022-11-24 14:00:19.689867+08",1,"en-us"
151,"What happens if the customer cancels the job after I have arrived or when I am on the way?","For Deliveries Without Manpower:
If you have arrived, please provide proof of arrival and there will be a 50% cancellation fee, capped at a max of $10.  If you are on the way provided that the customer did not cancel the job before the pickup time starts, you will also be entitled 50% cancellation fee, capped at $10. For Deliveries with Manpower required, there is also a 50% cancellation fee charged on the manpower.","agent","2021-11-01 17:55:06.43953+08","2022-11-24 09:40:44.837602+08",1,"en-us"
152,"What happens if I need to change the delivery address?","If the job has been accepted by a delivery agent, there will be a new delivery charge depending on the situation. 

If the job has not yet been accepted by a delivery agent, you can cancel the job and repost it again. ","customer","2021-11-10 09:37:33.721901+08","2022-11-24 14:35:53.77125+08",1,"en-us"
153,"How do I add Insurance to my delivery request?","You can add insurance when you request delivery on the app or website before checkout.


","customer","2021-12-01 08:47:54.37418+08","2022-11-24 12:27:53.386013+08",1,"en-us"
154,"How much does uParcel charge for insurance coverage?","Every delivery includes $100 in basic insurance.

The additional insurance amount is calculated as follows:
1 hour Rush - 1.2% 
Same day, 3 Hours Express, 2 Way Round Trip - 1.5% 
Next Day, Specific Delivery Slot - 2%

Example: For additional insurance coverage amount of $1,000, 
using Same Day, 3 hours, or 2 Way Round Trip, insurance = 1.5% x $1,000 = $15
You will need to pay $15 for the additional insurance coverage of $1,000.
(Maximum additional insurance coverage is capped at $1,500.)

Please note that &#x27;My Fleet&#x27; cannot be selected if you are purchasing additional insurance.","customer","2021-12-01 08:50:48.00952+08","2022-11-24 13:44:37.516122+08",1,"en-us"
155,"What happens if my parcel weight/size is under-declared?","The driver has the right to refuse the delivery request and will refund you 50% of the original fee if they inspect your package and determine it to be under-declared.","customer","2022-03-31 16:39:15.624489+08","2022-11-24 14:48:04.126994+08",1,"en-us"
156,"What happens if the parcel weight/size is under-declared?","If a parcel is deemed to be underdeclared, there are 2 options:

1) Get written approval from Sender/Job requester that there will be additional charges and continue the delivery. You will need to upload a photo that clearly shows either the weight (kg) or the size (H+L+W in cm) of the parcel once you complete the delivery. Then use the ‘Contact us’ on the app to inform our Customer Service team to add on this charge. This will be reflected in your next statement once it is approved.

2)	If you cannot continue the delivery due to unavailable space in your vehicle, please cancel the delivery as “Item is under-declared” in the agent app and upload a photo that clearly shows either the weight (kg) or the size (H+L+W in cm) of the parcel. After that, use the ‘Contact us’ on the app to inform our Customer Service team to add on this charge. This will be reflected in your next statement once it is approved.
","agent","2022-03-31 16:40:03.703456+08","2022-11-24 09:47:16.187339+08",1,"en-us"
157,"Is uParcel GST-Registered?","Yes, uParcel is required to be GST-Registered by IRAS, and we are required to charge GST on the platform commission of 20% of the delivery fee.","customer","2022-03-31 18:57:36.153737+08","2022-11-24 14:24:34.684432+08",1,"en-us"
158,"How do I increase delivery request acceptance rate?","1. You can increase the delivery request acceptance rate by adding &#x27;Tips&#x27; to the delivery request before you proceed to make payment.

or

2. Add tips to the jobs that have been posted to increase the acceptance rate.
Go to Manage Delivery - Click on the delivery and &#x27;Add Tips&#x27;, after that proceed to make payment for the tips and the tips will be added to your job. These tips will increase the delivery price and entice the delivery agent to accept your request during peak periods.","customer","2022-05-30 14:33:28.138036+08","2022-11-24 12:41:41.200139+08",1,"en-us"
159,"What time does Night Surcharge start?","Night delivery runs from 11 p.m. to 7 a.m. the following day.

Any delivery request from 12am to 1am, 1am to 2am, 2am to 3am, and so on would be subjected to the surcharge, and the last slot with the night surcharge will be 7am to 8pm. There will be no night surcharge from 8am onwards.","customer","2022-09-13 10:55:04.891729+08","2023-06-15 16:54:17.718434+08",1,"en-us"
160,"How much is the Night Surcharge?","Our 'Night Delivery' is only available for 1 Hour Rush service, from 11 pm to 7 am. Any delivery bookings made after 11 pm will be subject to a $15 Night Surcharge. 

Night delivery starts from 11 pm to 8 am the next day and would be subjected to the night delivery surcharge and the last slot with night surcharge will be 7 am – 8 am. There will be no night surcharge from 8 am onwards.","customer","2022-09-13 10:57:39.490377+08","2023-06-15 16:52:25.566331+08",1,"en-us"
161,"Can I make a claim for lost or damaged parcels?","(a) Any claims for damage or loss to the Delivery Item must be made within 3 days from the date on which uParcel accepts the Delivery Item for delivery, failing which uParcel shall have no liability whatsoever.

(c) All claims must be made in writing, accompanied by the original consignment note, waybill, relevant invoices and receipts and other supporting documents requested by uParcel and submitted to the following email address: express@uparcel.sg

(d) Claims are limited to one claim per delivery Item. Settlement of which shall be a full and final settlement for all loss or damage in connection therewith. ","customer","2022-09-14 16:34:25.015258+08","2022-11-24 11:35:23.09178+08",1,"en-us"
162,"How much can I claim for my loss or damage packages?","(a) For any loss or damage packages, you can only claim the value of item&#39;s cost price or SGD$100 per delivery order, whichever is lower.

(b) All claims must be made in writing, accompanied by the original consignment note, waybill, relevant invoices and receipts and other supporting documents requested by uParcel and submitted to the following email address: express@uparcel.sg

(c) Claims are limited to one claim per Delivery Item, settlement of which shall be a full and final settlement for all loss or damage in connection therewith. ","customer","2022-09-14 16:36:04.52298+08","2022-09-14 16:36:04.522987+08",15,"en-us"
163,"What&#x27;s the maximum amount can I claim for lost or damaged packages?","Provided that uParcel is satisfied that your claim is justified, uParcel&#x27;s liability for any loss of or damage to the delivery item shall be limited to the value of the delivery item&#x27;s purchase price or S$100 per delivery order, whichever is lower. 

This must be supported with proof of item value.","customer","2022-09-15 08:47:56.879982+08","2022-11-24 16:07:59.782252+08",1,"en-us"
164,"我可以在接受工作后取消吗？","一旦接受工作，您就不能取消，除非在最后一刻进行更改。如果您需要取消，请点击取消按钮并输入原因。请注意，多次取消将导致帐户暂停。","agent","2022-11-29 09:06:34.615789+08","2022-11-29 09:06:34.615795+08",1,"zh"
165,"我可以和客户更改取件和送货时间吗？","请不要与客户更改交货时间，这会给客户带来不便。如果您不能在规定时间内完成工作，请不要接受工作。","agent","2022-11-29 09:07:03.663498+08","2022-11-29 09:07:03.663504+08",1,"zh"
166,"我可以关闭 GPS 跟踪吗？","您可以关闭 GPS 跟踪。当您注销时，GPS 跟踪也会自动关闭。但是，您需要在接受工作之前和递送时打开您的 GPS 跟踪。","agent","2022-11-29 09:07:25.792293+08","2022-11-29 09:07:25.792298+08",1,"zh"
167,"我需要汽车来送货吗？","不，您可以使用任何交通方式。如果您需要汽车，我们推荐 TribeCar。在您附近的地点按小时出租。 https://www.tribecar.com","agent","2022-11-29 09:07:49.995855+08","2022-11-29 09:07:49.995862+08",1,"zh"
168,"Van and Lorry Delivery，驾面包车或卡车的快递员需要帮忙装卸货物吗？","是的，驾面包车或卡车的快递员需要协助装卸货物。","agent","2022-11-29 09:08:40.56696+08","2022-11-29 09:08:40.566965+08",1,"zh"
169,"快递员的薪水怎么分配？","1 日至 15 日之间完成的工作将在 22 日至 24 日之间处理，16 日至 31 日之间交付的工作将在下个月的 7 日至 9 日之间处理。付款将通过 GIRO 银行转账到提供的银行账户。根据您的银行，金额需要 1-3 天才能反映在您的帐户中。请注意，在支付送货费之前，工作状态必须为“已送达”。","agent","2022-11-29 09:09:10.610778+08","2022-11-29 09:09:10.610783+08",1,"zh"
170,"我如何向 uParcel 支付佣金？","快递员可以赚取 80% 的运费。 20%的送货费交给uParcel来维护平台，交易来投放广告让更多的客户使用uParcel，这样我们可以带给我们的快递员更多的工作选择。","agent","2022-11-29 09:09:33.537474+08","2022-11-29 09:09:33.53748+08",1,"zh"
171,"我接受了 3 小时的快递请求。我需要在什么时候送到？","3 小时的交货时间范围在交货详情中注明。如果规定为上午 9 点至中午 12 点，则您需要在这段时间内交货。","agent","2022-11-29 09:09:59.267202+08","2022-11-29 09:09:59.267208+08",1,"zh"
172,"我是一个新的快递员，为什么我只能接手7份工作？","一旦您完成了 20 次以上的交付并获得 4 分及以上的评分，您将能够接受无限次的工作。","agent","2022-11-29 09:10:31.740315+08","2022-11-29 09:10:31.740321+08",1,"zh"
173,"是否有关于如何使用 uParcel APP的指南？","是的，您可以在我们网站的底部下载我们的用户指南。请在快速链接下找到它：“快递员应用程序用户指南”。","agent","2022-11-29 09:10:58.370728+08","2022-11-29 09:10:58.370734+08",1,"zh"
174,"包裹没有成功送达怎么办？","请将状态更新为“未送达”并输入原因，例如“客户要求将日期更改为 XXX 或客户不在”。您可以在 3 个工作日内重新尝试发货，并且没有额外费用。所有易腐烂的东西都不能重试，会留在门口。请致电 WhatsApp 收件人告知物品留在门口。","agent","2022-11-29 09:11:21.903697+08","2022-11-29 09:11:21.903702+08",1,"zh"
175,"附加服务项下“需要人力”是着什么？","人手需求是指货车/货车司机需要带一个额外的帮手来协助装卸货物。需要的人手数量是指需要的帮工数量，不包括司机。","agent","2022-11-29 09:11:55.744763+08","2022-11-29 09:11:55.744769+08",1,"zh"
176,"送货价格包括什么？","它包括所有费用，例如 ERP、通行费、停车费、杂项等。","agent","2022-11-29 09:12:10.221654+08","2022-11-29 09:12:10.22166+08",1,"zh"
177,"如果我迟交包裹会怎样？有罚款吗？","如果您延迟交付包裹，uParcel 可能会扣除您高达 50% 的运费，如果物品（如果是食品）因延迟交付而损坏，您将需要赔偿该物品。如果您的延迟交货次数过多，您的帐户也将被永久停用。","agent","2022-11-29 09:12:40.15546+08","2022-11-29 09:12:40.155466+08",1,"zh"
178,"如果客户在我到达后或途中取消工作，会发生什么情况？","如果您已抵达，请提供抵达证明，将收取 50% 的取消费，最高不超过 10 美元。如果您在途中，前提是客户没有在取件时间开始前取消任务，您还将有权收取 50% 的取消费，上限为 10 美元。对于需要人力的交付，还需对人力收取 50% 的取消费。","agent","2022-11-29 09:13:00.221195+08","2022-11-29 09:13:00.221203+08",1,"zh"
179,"如果包裹重量/尺寸申报不足怎么办？","1) 获得发件人/工作请求者的书面批准，将收取额外费用并继续交付。完成派送后，您需要上传一张清楚显示包裹重量（公斤）或尺寸（高+长+宽厘米）的照片。然后使用应用程序上的“联系我们”通知我们的客户服务团队增加这笔费用。一旦获得批准，这将反映在您的下一份声明中。

2) 如果您因车辆空间不足无法继续派送，请在代理应用程序中以“Item is under-declared”为由取消派送，并上传清楚显示重量（kg）或尺寸（H）的照片+L+W（厘米）。之后，使用应用程序上的“联系我们”通知我们的客户服务团队增加此费用。一旦获得批准，这将反映在您的下一份声明中。
","agent","2022-11-29 09:13:39.460196+08","2022-11-29 09:13:39.460202+08",1,"zh"
180,"如果提供的地址有误怎么办？","如果您到达了客户提供的错误取件地址，将收取 50% 的取消费，最高不超过 10 美元。

如果您到达了客户提供的错误送货地址，需要送货到新的送货地址，将收取新的送货费用。

如果您没有到达送货地址，并且在您取货后提供了新地址，则更改地址将收取 3 美元的费用。
","agent","2022-11-29 09:14:03.87819+08","2022-11-29 09:14:03.878196+08",1,"zh"
181,"如果我在送货时丢失了包裹怎么办？","我们建议快递员打电话检查是否有人在附近接收它。如果包裹交付时没有收件人，您将在 3 天内免费重新交付，或者您可以在发件人同意的情况下在 2 天内退回。但是，如果包裹在第 2 次尝试仍无法派送，则可以将包裹退回给寄件人。
将包裹退回给客户的费用为 7 美元* 或价格的 50%*，以较高者为准。如果有的话，这需要额外收费。请在退回包裹前联系发件人和 uParcel 管理员，告知他们投递失败。所有易腐烂物品将留在门口，不再尝试。请致电并发送 WhatsApp 给物品落在门口的收件人。

*退货费可能不适用于某些客户
","agent","2022-11-29 09:14:41.272364+08","2022-11-29 09:14:41.27237+08",1,"zh"
182,"如果在取件或派送包裹期间寄件人或收件人不在家怎么办？","我们建议快递员商在取件和派送前致电或发送短信给寄件人/收件人，以检查他们是否在家，以免浪费行程。

如因收件人原因无法在规定时间内派送，请安排3日内重新派送，或经发件人同意后2日内退回。

未经收件人同意，请勿将包裹留在门口。如果建议您将包裹留在门口，请索取短信作为证明，并拍下您遗忘的地方。
","agent","2022-11-29 09:15:16.013071+08","2022-11-29 09:15:16.013077+08",1,"zh"
183,"扫描二维码的目的是什么？","这是为了减轻送货代理在搜索特定工作请求以更新送货状态时的不便。
 
这可以通过单击“扫描 QR”选项卡并扫描运单上的代码来更新您的交付状态来完成。
","agent","2022-11-29 09:15:45.423376+08","2022-11-29 09:15:45.423381+08",1,"zh"
184,"什么是“我的舰队”列表？","客户现在可以将您作为他们信任的快递员添加到他们的“我的车队”列表中，他们可以选择您或他们的“我的车队”中的快递员列表来发送工作订单。

在这种情况下，只有选定的“我的车队”代理会收到客户的工作请求通知。

等待 10 分钟后，如果“我的车队”的快递员没有接受，则客户将继续取消工作请求，并改为向 uParcel 应用程序中可用的所有的快递员重新发布。
","agent","2022-11-29 09:16:18.245194+08","2022-11-29 09:16:18.245199+08",1,"zh"
185,"包裹需要退回寄件人怎么办？","请将状态更新为“未送达”并说明原因。退回给发件人后，请将状态更新为“已退回”。","agent","2022-11-29 09:16:42.360461+08","2022-11-29 09:16:42.360467+08",1,"zh"
186,"快递时APP提示输入密码怎么办？","请从收件人处获取Pincode，并在更新到交付时将其输入到应用程序中。如果收件人不确定，请联系发件人索取 Pincode 或联系我们。","agent","2022-11-29 09:17:06.462503+08","2022-11-29 09:17:06.462508+08",1,"zh"
187,"我在哪里可以完成快递员测验？","在uParcel 快递员应用程序中，点出“个人资料”就能找到测验。","agent","2022-11-29 09:17:32.686622+08","2022-11-29 09:17:32.686628+08",1,"zh"
188,"我在哪里可以下载工作单据？","您可以通过单击“单据”选项卡来下载它。您还可以选择将工作单据发送到您的电子邮件。","agent","2022-11-29 09:17:49.675687+08","2022-11-29 09:17:49.675693+08",1,"zh"
189,"为什么应用程序上没有显示任何工作？","一旦被其他代理人接受，这些工作就会消失。

平均 90% 的交付请求在发布后 10 分钟内被接受。

当您距离上车地点不远时，您将收到通知。
","agent","2022-11-29 09:18:11.160172+08","2022-11-29 09:18:11.160177+08",1,"zh"
190,"为什么快递员需要通过验证才能开始送货？","uParcel 建立在值得信赖的递送代理社区之上。我们中间没有陌生人。

我们需要验证快递员以证明他们的身份并保护所有用户。
","agent","2022-11-29 09:18:36.512041+08","2022-11-29 09:18:36.512047+08",1,"zh"
191,"为什么我需要在手机上启用 GPS 跟踪？","GPS 跟踪让用户知道包裹的位置。它还可以作为包裹已送达的证据，因为状态更新会自动标记投递地点。

快递员可以在不交付包裹时关闭其 GPS 跟踪。转到 uParcel 应用程序-设置-GPS 跟踪。
","agent","2022-11-29 09:19:05.301694+08","2022-11-29 09:19:05.301701+08",1,"zh"
192,"为什么我无法接受任何派送工作？","所有的快递员都必须完成他们的个人资料并通过测验。这样做之后，帐户批准最多需要 1 周的时间来验证您的个人详细信息和 ID。

如果您在更新个人资料时遇到问题，则需要启用 uParcel 应用程序权限才能访问您的相机。

请进入通用设置-权限。在权限选项卡中，您必须单击相机、存储和您的位置选项以允许对应用程序的权限。然后注销，关闭应用程序，打开应用程序并再次登录。
","agent","2022-11-29 09:19:32.908367+08","2022-11-29 09:19:32.908371+08",1,"zh"
193,"为什么我无法上传我的头像？","这可能是因为您的手机设置不允许 uParcel 应用程序访问您的相机和照片。请转到常规设置许可。

在权限选项卡中，您必须单击相机、存储和您的位置选项以允许对应用程序的权限。然后注销-重启手机，重新登录。
","agent","2022-11-29 09:19:54.408842+08","2022-11-29 09:19:54.408848+08",1,"zh"
194,"当客户从他们的“我的车队”列表中添加或删除我时，我会收到通知吗？","是的，当客户在他们的“我的车队”列表中添加或删除您时，您会收到电子邮件通知。","agent","2022-11-29 09:20:36.692777+08","2022-11-29 09:20:36.692782+08",1,"zh"
195,"其他人可以查看我的资料吗？","不可以。只有 uParcel 授权的员工才能访问您的详细信息。包裹寄件人只能在应用程序上查看您的联系电话和照片。","agent","2022-11-29 09:21:00.67948+08","2022-11-29 09:21:00.679486+08",1,"zh"
